{
  "actor": "shiki-cli",
  "evidence": [
    "https://github.com/mizutani-140/oss-trend-radar/issues/1"
  ],
  "goal_id": "G-0002",
  "id": "L-0007",
  "links": [
    "https://github.com/mizutani-140/oss-trend-radar/issues/1"
  ],
  "summary": "GitHub Issue #1 created for T-0002",
  "task_id": "T-0002",
  "timestamp": "2026-05-29T08:53:48+00:00",
  "type": "handoff"
}
