{
  "actor": "shiki-cli",
  "evidence": [
    ".shiki/tasks/T-0006.json"
  ],
  "goal_id": "G-0002",
  "id": "L-0017",
  "links": [],
  "summary": "Task registered: \u4fee\u5fa9: \u65e5\u6b21\u30ec\u30dd\u30fc\u30c8publish\u306e\u30d6\u30e9\u30f3\u30c1\u5207\u66ff\u885d\u7a81(\u540c\u65e5\u518d\u5b9f\u884c/\u30b9\u30ca\u30c3\u30d7\u30b7\u30e7\u30c3\u30c8)",
  "task_id": "T-0006",
  "timestamp": "2026-05-30T05:56:52+00:00",
  "type": "task-registered"
}
